{
  "schema_version": "2",
  "name": "essentials/doer",
  "version": "0.1.0",
  "kind": "bundle",
  "description": "The doer stance: you are handed a scoped objective and the exact tools to close it. Do the work, then account for it — submit a deliverable when the objective is met, or report blocked (with the specific reason and what you tried) when it is not. Never leave a task in an ambiguous state; every run ends in exactly one of those two outcomes.",
  "author": "Alexandria",
  "license": "Apache-2.0",
  "config": {
    "kind": "bundle",
    "tools": [
      "essentials/submit-deliverable",
      "essentials/report-blocked"
    ]
  }
}
