{
  "schema_version": "2",
  "name": "acme/my-tool",
  "version": "0.1.0",
  "kind": "mcp",
  "description": "TODO: describe what this tool does",
  "author": "TODO",
  "license": "Apache-2.0",
  "config": {
    "kind": "mcp",
    "binary": "bin/my-tool",
    "default_port": 7800,
    "transport": "http",
    "args": [],
    "interface_major": 1
  },
  "files": [
    {
      "archive_path": "bin/my-tool",
      "install_path": "tools/my-tool/bin/my-tool",
      "executable": true
    }
  ],
  "permissions": {
    "provides_tools": ["my-tool"],
    "suggested_role": "worker"
  }
}
